{
  "abort_state": {
    "aborted": false,
    "reason": null
  },
  "blocker_status": {
    "blocked": false,
    "blockers": [],
    "next_actions": []
  },
  "command_log_paths": [
    "C:\\Users\\Chris\\Documents\\GitHub\\Control_System\\logs\\20260617_hf2li_60s_record_command_log.txt"
  ],
  "config_hash": "09b0759147b79505a96066759b577ff992f24ade93d0bf7304ba99f6e1269a99",
  "config_path": "C:\\Users\\Chris\\Documents\\GitHub\\Control_System\\hardware_configuration.yaml",
  "device_ids": {
    "arduino_mux": {
      "display_name": "Arduino MUX Controller",
      "preferred_port": "COM6",
      "role": "mux_controller"
    },
    "hf2li": {
      "device_id": "18500",
      "display_name": "Zurich Instruments HF2LI",
      "role": "lockin_amplifier"
    },
    "mircat": {
      "display_name": "Daylight MIRcat",
      "model_number": "MIRcat-QT-Z-2100",
      "preferred_port": "COM9",
      "role": "probe_laser",
      "serial_number": "10524"
    },
    "picoscope": {
      "display_name": "PicoScope 5000 Series",
      "model": "5244D",
      "role": "oscilloscope",
      "serial_number": "10261"
    },
    "slopo": {
      "display_name": "SLOPO / Horizon OPO",
      "preferred_port": "COM4",
      "role": "opo_controller",
      "serial_number": "USER INPUT REQUIRED"
    },
    "t660_1": {
      "display_name": "T660-1",
      "preferred_port": "COM3",
      "role": "pump_timing",
      "serial_number": "00369"
    },
    "t660_2": {
      "display_name": "T660-2",
      "preferred_port": "COM7",
      "role": "master_timing_trains_frames",
      "serial_number": "00431"
    }
  },
  "device_readback_paths": [
    "C:\\Users\\Chris\\Documents\\GitHub\\Control_System\\runs\\20260617_hf2li_60s_record\\hf2li_summary.csv",
    "C:\\Users\\Chris\\Documents\\GitHub\\Control_System\\runs\\20260617_hf2li_60s_record\\settings_snapshot.json",
    "C:\\Users\\Chris\\Documents\\GitHub\\Control_System\\runs\\20260617_hf2li_60s_record\\settings_reload_snapshot.json",
    "C:\\Users\\Chris\\Documents\\GitHub\\Control_System\\runs\\20260617_hf2li_60s_record\\settings_reload_result.json",
    "C:\\Users\\Chris\\Documents\\GitHub\\Control_System\\runs\\20260617_hf2li_60s_record\\settings_reload_comparison.json"
  ],
  "error_state": {
    "errors": [],
    "has_error": false
  },
  "git_commit": "ef9f9d5bb3cbb71acb05a0ed3f0aad35fffb4bc3",
  "hf2li_settings_snapshot": {
    "applied": {
      "device_id": "dev18500",
      "preset": "dark_baseline",
      "timestamp_utc": "2026-06-17T13:00:24+00:00"
    },
    "preset": "dark_baseline",
    "save_summary": {
      "path_count": 4,
      "raw_csv_path": "C:\\Users\\Chris\\Documents\\GitHub\\Control_System\\runs\\20260617_hf2li_60s_record\\hf2li_raw_samples.csv",
      "sample_count": 432012,
      "summary_csv_path": "C:\\Users\\Chris\\Documents\\GitHub\\Control_System\\runs\\20260617_hf2li_60s_record\\hf2li_summary.csv",
      "timestamp_utc": "2026-06-17T13:01:27+00:00"
    },
    "settings_reload_comparison_path": "C:\\Users\\Chris\\Documents\\GitHub\\Control_System\\runs\\20260617_hf2li_60s_record\\settings_reload_comparison.json",
    "settings_reload_match": true,
    "settings_reload_snapshot_path": "C:\\Users\\Chris\\Documents\\GitHub\\Control_System\\runs\\20260617_hf2li_60s_record\\settings_reload_snapshot.json",
    "settings_snapshot_path": "C:\\Users\\Chris\\Documents\\GitHub\\Control_System\\runs\\20260617_hf2li_60s_record\\settings_snapshot.json"
  },
  "mircat_actual_wavelength": null,
  "mircat_setpoint": null,
  "mux_routes": {},
  "operator": "Codex Day 6",
  "picoscope_settings": {},
  "raw_data_paths": [
    "C:\\Users\\Chris\\Documents\\GitHub\\Control_System\\runs\\20260617_hf2li_60s_record\\hf2li_raw_samples.csv"
  ],
  "t660_recipes": [],
  "timestamp_utc": "2026-06-17T13:01:27+00:00",
  "timing_offset_file": null
}
