{
  "abort_state": {
    "aborted": false,
    "reason": null
  },
  "blocker_status": {
    "blocked": false,
    "blockers": [],
    "next_actions": []
  },
  "command_log_paths": [
    "C:\\Users\\Chris\\Documents\\GitHub\\Control_System\\logs\\20260618_picoscope_settings_test_command_log.txt"
  ],
  "config_hash": "2cd31abe64978db566aecaffaf9cc81528d79400cb5c9bd0003cf922088c7ca7",
  "config_path": "C:\\Users\\Chris\\Documents\\GitHub\\Control_System\\hardware_configuration.yaml",
  "device_ids": {
    "arduino_mux": {
      "display_name": "Arduino MUX Controller",
      "preferred_port": "COM6",
      "role": "mux_controller"
    },
    "hf2li": {
      "device_id": "18500",
      "display_name": "Zurich Instruments HF2LI",
      "role": "lockin_amplifier"
    },
    "mircat": {
      "display_name": "Daylight MIRcat",
      "model_number": "MIRcat-QT-Z-2100",
      "preferred_port": "COM9",
      "role": "probe_laser",
      "serial_number": "10524"
    },
    "picoscope": {
      "display_name": "PicoScope 5000 Series",
      "model": "5244D",
      "role": "oscilloscope",
      "serial_number": "10261"
    },
    "slopo": {
      "display_name": "SLOPO / Horizon OPO",
      "preferred_port": "COM4",
      "role": "opo_controller",
      "serial_number": "USER INPUT REQUIRED"
    },
    "t660_1": {
      "display_name": "T660-1",
      "preferred_port": "COM3",
      "role": "pump_timing",
      "serial_number": "00369"
    },
    "t660_2": {
      "display_name": "T660-2",
      "preferred_port": "COM7",
      "role": "master_timing_trains_frames",
      "serial_number": "00431"
    }
  },
  "device_readback_paths": [
    "C:\\Users\\Chris\\Documents\\GitHub\\Control_System\\runs\\20260618_picoscope_settings_test\\picoscope_settings_request.json",
    "C:\\Users\\Chris\\Documents\\GitHub\\Control_System\\runs\\20260618_picoscope_settings_test\\picoscope_settings_apply_summary.json"
  ],
  "error_state": {
    "errors": [],
    "has_error": false
  },
  "git_commit": "ef9f9d5bb3cbb71acb05a0ed3f0aad35fffb4bc3",
  "hf2li_settings_snapshot": {},
  "mircat_actual_wavelength": null,
  "mircat_setpoint": null,
  "mux_routes": {},
  "operator": "Chris",
  "picoscope_settings": {
    "channels": {
      "A": {
        "analog_offset_v": 0.0,
        "coupling": "DC",
        "enabled": true,
        "range": "10V"
      },
      "B": {
        "analog_offset_v": 0.0,
        "coupling": "DC",
        "enabled": true,
        "range": "10V"
      }
    },
    "external_trigger": {
      "auto_trigger_ms": 0,
      "delay_samples": 0,
      "direction": 2,
      "direction_name": "rising",
      "source": "EXT",
      "threshold_adc": 5000
    },
    "pre_trigger_samples": 1000,
    "pulse_count_threshold_adc": 5000,
    "resolution": "8BIT",
    "timebase": 1,
    "timeout_s": 10.0,
    "total_samples": 100000
  },
  "raw_data_paths": [],
  "t660_recipes": [],
  "timestamp_utc": "2026-06-18T16:45:52+00:00",
  "timing_offset_file": null
}
