{
  "abort_state": {
    "aborted": false,
    "reason": null
  },
  "blocker_status": {
    "blocked": false,
    "blockers": [],
    "next_actions": []
  },
  "command_log_paths": [
    "C:\\Users\\Chris\\Documents\\GitHub\\Control_System\\logs\\20260618_arduino_mux_command_log.txt"
  ],
  "config_hash": "2cd31abe64978db566aecaffaf9cc81528d79400cb5c9bd0003cf922088c7ca7",
  "config_path": "C:\\Users\\Chris\\Documents\\GitHub\\Control_System\\hardware_configuration.yaml",
  "device_ids": {
    "arduino_mux": {
      "display_name": "Arduino MUX Controller",
      "preferred_port": "COM6",
      "role": "mux_controller"
    },
    "hf2li": {
      "device_id": "18500",
      "display_name": "Zurich Instruments HF2LI",
      "role": "lockin_amplifier"
    },
    "mircat": {
      "display_name": "Daylight MIRcat",
      "model_number": "MIRcat-QT-Z-2100",
      "preferred_port": "COM9",
      "role": "probe_laser",
      "serial_number": "10524"
    },
    "picoscope": {
      "display_name": "PicoScope 5000 Series",
      "model": "5244D",
      "role": "oscilloscope",
      "serial_number": "10261"
    },
    "slopo": {
      "display_name": "SLOPO / Horizon OPO",
      "preferred_port": "COM4",
      "role": "opo_controller",
      "serial_number": "USER INPUT REQUIRED"
    },
    "t660_1": {
      "display_name": "T660-1",
      "preferred_port": "COM3",
      "role": "pump_timing",
      "serial_number": "00369"
    },
    "t660_2": {
      "display_name": "T660-2",
      "preferred_port": "COM7",
      "role": "master_timing_trains_frames",
      "serial_number": "00431"
    }
  },
  "device_readback_paths": [
    "calibration\\arduino_mux_status.json",
    "calibration\\arduino_mux_route_verification.csv"
  ],
  "error_state": {
    "errors": [],
    "has_error": false
  },
  "git_commit": "ef9f9d5bb3cbb71acb05a0ed3f0aad35fffb4bc3",
  "hf2li_settings_snapshot": {},
  "mircat_actual_wavelength": null,
  "mircat_setpoint": null,
  "mux_routes": {
    "requested_routes": {
      "output_a": "dmb1_c0_hf2li_dio9",
      "output_b": "dmb2_c1_hf2li_dio10",
      "output_ext": "dmb3_c2_hf2li_dio11"
    },
    "route_readback": {
      "latched_routes": {
        "output_a": "dmb1_c0_hf2li_dio9",
        "output_b": "dmb2_c1_hf2li_dio10",
        "output_ext": "dmb3_c2_hf2li_dio11"
      },
      "response": "ROUTES A=DMB1_C0_HF2LI_DIO9 B=DMB2_C1_HF2LI_DIO10 EXT=DMB3_C2_HF2LI_DIO11",
      "timestamp_utc": "2026-06-18T16:45:35+00:00"
    },
    "route_responses": {
      "output_a": "OK ROUTE A DMB1_C0_HF2LI_DIO9",
      "output_b": "OK ROUTE B DMB2_C1_HF2LI_DIO10",
      "output_ext": "OK ROUTE EXT DMB3_C2_HF2LI_DIO11"
    }
  },
  "operator": "Chris",
  "picoscope_settings": {},
  "raw_data_paths": [],
  "t660_recipes": [],
  "timestamp_utc": "2026-06-18T16:45:39+00:00",
  "timing_offset_file": null
}
