{
  "abort_state": {
    "aborted": false,
    "reason": null
  },
  "blocker_status": {
    "blocked": false,
    "blockers": [],
    "next_actions": []
  },
  "command_log_paths": [
    "C:\\Users\\Chris\\Documents\\GitHub\\Control_System\\logs\\20260616_mircat_status_tune_command_log.txt"
  ],
  "config_hash": "09b0759147b79505a96066759b577ff992f24ade93d0bf7304ba99f6e1269a99",
  "config_path": "C:\\Users\\Chris\\Documents\\GitHub\\Control_System\\hardware_configuration.yaml",
  "device_ids": {
    "arduino_mux": {
      "display_name": "Arduino MUX Controller",
      "preferred_port": "COM6",
      "role": "mux_controller"
    },
    "hf2li": {
      "device_id": "18500",
      "display_name": "Zurich Instruments HF2LI",
      "role": "lockin_amplifier"
    },
    "mircat": {
      "display_name": "Daylight MIRcat",
      "model_number": "MIRcat-QT-Z-2100",
      "preferred_port": "COM9",
      "role": "probe_laser",
      "serial_number": "10524"
    },
    "picoscope": {
      "display_name": "PicoScope 5000 Series",
      "model": "5244D",
      "role": "oscilloscope",
      "serial_number": "10261"
    },
    "slopo": {
      "display_name": "SLOPO / Horizon OPO",
      "preferred_port": "COM4",
      "role": "opo_controller",
      "serial_number": "USER INPUT REQUIRED"
    },
    "t660_1": {
      "display_name": "T660-1",
      "preferred_port": "COM3",
      "role": "pump_timing",
      "serial_number": "00369"
    },
    "t660_2": {
      "display_name": "T660-2",
      "preferred_port": "COM7",
      "role": "master_timing_trains_frames",
      "serial_number": "00431"
    }
  },
  "device_readback_paths": [
    "C:\\Users\\Chris\\Documents\\GitHub\\Control_System\\runs\\20260616_mircat_status_tune\\mircat_tune_request.json",
    "C:\\Users\\Chris\\Documents\\GitHub\\Control_System\\runs\\20260616_mircat_status_tune\\mircat_state_readback.json",
    "C:\\Users\\Chris\\Documents\\GitHub\\Control_System\\runs\\20260616_mircat_status_tune\\mircat_status_tune_summary.json"
  ],
  "error_state": {
    "errors": [],
    "has_error": false
  },
  "git_commit": "5025eaef91254a58d31e8e1823da0040bd85079d",
  "hf2li_settings_snapshot": {},
  "mircat_actual_wavelength": {
    "light_valid": true,
    "units": "microns",
    "value": 5.3821330070495605
  },
  "mircat_setpoint": {
    "qcl": 1,
    "units": "cm^-1",
    "value": 1858.0
  },
  "mux_routes": {},
  "operator": "Codex",
  "picoscope_settings": {},
  "raw_data_paths": [
    "C:\\Users\\Chris\\Documents\\GitHub\\Control_System\\runs\\20260616_mircat_status_tune\\mircat_actual_wavelength_record.json"
  ],
  "t660_recipes": [],
  "timestamp_utc": "2026-06-16T17:28:44+00:00",
  "timing_offset_file": null
}
